{
  "id": "towerdef-0001",
  "name": "Corehold",
  "created_at": "2026-10-03T00:58:54.944Z",
  "updated_at": "2026-10-03T23:07:05.291Z",
  "status": "validated",
  "concept": {
    "theme": {
      "premise": "a lone frontier mining outpost whose drill-core tower holds out against endless waves of blocky scrap-machines, rebuilding a little stronger after every fall",
      "tone": "tense, gritty, deeply satisfying — the steady grind of a base that keeps getting stronger",
      "mood_keywords": [
        "industrial",
        "blocky",
        "escalating",
        "grind"
      ],
      "setting": "a scorched rust-and-slate frontier plateau under a dusty dusk sky"
    },
    "genre": "incremental roguelite tower defense",
    "core_loop": "A central core tower auto-fires at continuous waves (~25s each) of machines that always walk to the center. Kills pay CASH (spent live on temporary in-run levels for any tapped building), XP (a full bar opens a seeded 3-card building DRAFT while time slows to 20% — place a new run-only building in a free slot or +1 an owned type) and COINS (banked at death to permanently place/upgrade buildings and core stats on the persistent 5x5 base between runs). The live decision every pick and every cash spend: the 24 base slots are scarce and each goes to eco OR defense — building eco (Mine, Oil Mill, Bounty Office) gains faster leveling and cash but gives up the firepower to survive the next spike; adjacency (Armory beside weapons, Oil Mill beside Mines) makes placement matter. Difficulty: enemy HP/damage x1.12 per wave, spawn rate ramps to a MAX cap, and every 10th wave is a boss spike that punishes greedy bases.",
    "mechanics": [
      "central core tower auto-targeting nearest enemy in range",
      "continuous waves with Drone/Skitter/Hauler enemies and a boss every 10th wave; HP/damage scale per wave, spawn rate capped",
      "fixed 5x5 base grid around the core (24 slots), outer ring locked until bought",
      "8 buildings as stat modifiers: Gun Turret, Mortar (splash), Tesla Coil (chain+slow), Armory (adjacent weapon dmg), Bulwark (HP+regen), Mine (cash/sec), Oil Mill (XP gain, Mine adjacency), Bounty Office (cash per kill)",
      "in-run cash: tap a building to buy temporary levels",
      "XP bar + level-up 3-card building draft with 20% slow-mo",
      "coins banked on death",
      "Base screen: permanent placement/upgrade of buildings, slot unlocks, core stat upgrades with coins",
      "persistent save of base layout, levels and coins",
      "core HP, death -> results screen -> base screen -> new run"
    ],
    "art_direction": "flat blocky top-down primitives on dark slate (#1b2027) with rust-orange accents; category colour-coding — weapons cyan, eco amber, support green, enemies red/magenta squares & triangles, core white with a pulsing ring; background: faint build-grid with drifting dust motes so no dead space; feedback: muzzle flash + hit flash, floating cash pops, screen shake + red vignette on core damage, radial burst on level-up, squash-pop when a building is placed or upgraded",
    "target_platforms": [
      "android"
    ],
    "differentiation_notes": "The Tower's proven idle-TD loop, but every upgrade — in-run draft, in-run cash and permanent workshop — is a physical building competing for 24 scarce adjacency-sensitive slots, turning stat-button menus into a spatial eco-vs-defense base-building puzzle."
  },
  "build": {
    "engine": "godot",
    "engine_version": "4.6.3.stable",
    "language": "gdscript",
    "project_path": "games/towerdef-0001/",
    "addons": [],
    "export_presets": [
      "android"
    ],
    "orientation": "portrait"
  },
  "assets": [
    {
      "type": "sprite",
      "name": "core",
      "source": "placeholder",
      "origin": "primitive"
    },
    {
      "type": "sprite",
      "name": "base_grid",
      "source": "placeholder",
      "origin": "primitive"
    },
    {
      "type": "sprite",
      "name": "buildings_x8",
      "source": "placeholder",
      "origin": "primitive"
    },
    {
      "type": "sprite",
      "name": "enemies_x4",
      "source": "placeholder",
      "origin": "primitive"
    },
    {
      "type": "sprite",
      "name": "fx_tracers_rings_pops",
      "source": "placeholder",
      "origin": "primitive"
    },
    {
      "type": "sprite",
      "name": "background_grid_dust",
      "source": "placeholder",
      "origin": "primitive"
    },
    {
      "type": "sprite",
      "name": "hud",
      "source": "placeholder",
      "origin": "primitive"
    }
  ],
  "validation": {
    "issues": [
      "playtest-audit (advisory): balanced campaign plateaus ~wave 30 by run 6 (18,20,28,29,29,30,30,30) — meta curve flattens; revisit costs in a deepen/run-meta pass",
      "playtest-audit (advisory): pure-eco is far weaker (best wave 7) — eco only pays off mixed with weapons, as designed, but eco may feel like a trap to new players",
      "builder (advisory): when all unlocked slots are full and only 2 types are owned, the draft offers 2 cards instead of 3"
    ],
    "opens_in_editor": true,
    "runs": true,
    "core_loop_functional": true,
    "interaction_functional": true
  },
  "_reserved": {
    "compliance": null,
    "store": null,
    "maintenance": null
  },
  "depth_pass": {
    "axis": "run-meta",
    "systems_added": [
      "save v2 + migration",
      "tiers 1-8",
      "boss bounty",
      "labs (real-time research, 12 tracks, 4 slots)",
      "game speed",
      "offline earnings",
      "daily missions + login streak",
      "cards (gems, slots, dupes)",
      "perks every 5 waves incl. tradeoffs",
      "ranged/elite/splitter enemies",
      "Vault + Aegis buildings",
      "7 adjacency synergies"
    ],
    "selftest_assertions_added": 25,
    "notes": "Built by studio workflow (designer, theorist, PM, 2 engine, art, UI, balance, visual-audit, PM acceptance, fix round). 30-day campaign sim: T2 by day 4, T3 by day 11, best wave climbs 30 -> 55+; eco-mix beats pure weapon. Spec in games/towerdef-0001/design/."
  },
  "audio_pass": {
    "method": "procedural",
    "audio_system": {
      "model": "jsfxr+zzfx+zzfxm",
      "sonic_character": "gritty industrial chiptune: low square/saw clanks and noise thumps for machinery, short dry bit-crushed hits, bright but restrained reward chimes; heavy register, quiet mix"
    },
    "recipes": [
      {
        "name": "shot_core",
        "kind": "sfx",
        "synth": {
          "zzfx": [
            1,
            0.05,
            180,
            0,
            0.01,
            0.06,
            1,
            1.6,
            -4,
            0,
            0,
            0,
            0,
            0.3,
            0,
            0.2
          ],
          "volume": 0.12,
          "seed": 1
        },
        "format": "wav",
        "loop": false
      },
      {
        "name": "shot_gun",
        "kind": "sfx",
        "synth": {
          "preset": "laserShoot",
          "seed": 11,
          "volume": 0.08,
          "overrides": {
            "wave_type": 0,
            "p_base_freq": 0.32,
            "p_env_attack": 0,
            "p_env_sustain": 0.12,
            "p_env_decay": 0.18,
            "p_freq_ramp": -0.35,
            "p_repeat_speed": 0,
            "p_lpf_freq": 0.6
          }
        },
        "format": "wav",
        "loop": false
      },
      {
        "name": "shot_mortar",
        "kind": "sfx",
        "synth": {
          "zzfx": [
            1,
            0.05,
            70,
            0.005,
            0.04,
            0.22,
            4,
            2,
            -2,
            0,
            0,
            0,
            0,
            0.9,
            0,
            0.3
          ],
          "volume": 0.2,
          "seed": 2
        },
        "format": "wav",
        "loop": false
      },
      {
        "name": "shot_tesla",
        "kind": "sfx",
        "synth": {
          "zzfx": [
            1,
            0.1,
            900,
            0,
            0.03,
            0.08,
            2,
            0,
            0,
            0,
            0,
            0,
            0.02,
            0.6,
            40,
            0.1
          ],
          "volume": 0.08,
          "seed": 3
        },
        "format": "wav",
        "loop": false
      },
      {
        "name": "hit",
        "kind": "sfx",
        "synth": {
          "preset": "hitHurt",
          "seed": 5,
          "volume": 0.08,
          "overrides": {
            "wave_type": 3,
            "p_env_sustain": 0.08,
            "p_env_decay": 0.18
          }
        },
        "format": "wav",
        "loop": false
      },
      {
        "name": "kill",
        "kind": "sfx",
        "synth": {
          "preset": "explosion",
          "seed": 6,
          "volume": 0.12,
          "overrides": {
            "p_base_freq": 0.22,
            "p_env_sustain": 0.15,
            "p_env_decay": 0.3
          }
        },
        "format": "wav",
        "loop": false
      },
      {
        "name": "shield_break",
        "kind": "sfx",
        "synth": {
          "zzfx": [
            1,
            0,
            1400,
            0,
            0.02,
            0.25,
            1,
            1,
            -30,
            0,
            0,
            0,
            0.03,
            0.5,
            0,
            0.2
          ],
          "volume": 0.2,
          "seed": 7
        },
        "format": "wav",
        "loop": false
      },
      {
        "name": "boss_spawn",
        "kind": "sfx",
        "synth": {
          "zzfx": [
            1,
            0,
            55,
            0.1,
            0.5,
            0.5,
            1,
            1.5,
            0,
            0,
            0,
            0,
            0.12,
            0.3,
            8,
            0.2,
            0,
            0.8
          ],
          "volume": 0.3,